
Bengkel Sinaga OpKenzo SAMPUR TOBA ,kecamatan HARIAN, SAMOSIR |GPJ9+JP4, Sampur Toba, Kec. Harian, Kabupaten Samosir, Sumatera Utara|0822-7985-5621|Alamat web tidak ditemukan|Bengkel Sinaga (Op.Kenzo)|2.5315004|98.7193213|Bengkel Sepeda Motor|Tidak ada review|Tidak ada review
Tonga Tonga SAMPUR TOBA ,kecamatan HARIAN, SAMOSIR |GPJ8+47Q, Sampur Toba, Kec. Harian, Kabupaten Samosir, Sumatera Utara|Nomor telepon tidak ditemukan|Alamat web tidak ditemukan|Lumban Tonga Tonga|2.530255|98.714762|Komplek perumahan|Tidak ada review|Tidak ada review
Rumah Kuning Rumah Op Kembar A SAMPUR TOBA ,kecamatan HARIAN, SAMOSIR |GPJ9+JRR, Sampur Toba, Kec. Harian, Kabupaten Samosir, Sumatera Utara|Nomor telepon tidak ditemukan|Alamat web tidak ditemukan|Rumah Kuning, Rumah Op. Kembar (A. Listi Simbolon)|2.5316114|98.7194947|Komplek perumahan|Tidak ada review|Tidak ada review
Opung Gultom SAMPUR TOBA ,kecamatan HARIAN, SAMOSIR |GPG9+GG, Sampur Toba, Kec. Harian, Kabupaten Samosir, Sumatera Utara|Nomor telepon tidak ditemukan|Alamat web tidak ditemukan|Opung Gultom|2.5263442|98.7188295|Komplek perumahan|Tidak ada review|Tidak ada review
Huta Lumban Pollung SAMPUR TOBA ,kecamatan HARIAN, SAMOSIR |GPJ8+47Q, Sampur Toba, Kec. Harian, Kabupaten Samosir, Sumatera Utara|0853-5955-6392|Alamat web tidak ditemukan|Huta Lumban Pollung|2.5303572|98.7157341|Komplek perumahan|Tidak ada review|Tidak ada review
LUMBAN SION ICA CELL Minimarket SAMPUR TOBA ,kecamatan HARIAN, SAMOSIR |GPH8+QV7, Lumbansion, Sampur Toba, Harian, Samosir Regency, North Sumatra|Nomor telepon tidak ditemukan|Alamat web tidak ditemukan|LUMBAN SION ICA CELL|2.5294184|98.7171658|Minimarket|Tidak ada review|Tidak ada review
Lapisan SAMPUR TOBA ,kecamatan HARIAN, SAMOSIR |Gagal|Gagal|Gagal|Gagal|Gagal|Gagal|Gagal|Gagal|Gagal
relusuri Google Maps SAMPUR TOBA ,kecamatan HARIAN, SAMOSIR |Gagal|Gagal|Gagal|Gagal|Gagal|Gagal|Gagal|Gagal|Gagal
