Place|Address|Phone Number|Website|Actual Place Name|Latitude|Longitude|Place Type|Latest Review|Review Date
Nauli pangsit PARHUSIP III ,kecamatan NAINGGOLAN, SAMOSIR |CVVH+73C, Sibonor Ompu Ratus, Kecamatan Nainggolan, Kabupaten Samosir, Sumatera Utara 22394|Nomor telepon tidak ditemukan|Alamat web tidak ditemukan|Nauli pangsit|2.4431915|98.8776344|Dapur Umum|Tidak ada review|Tidak ada review
Kedai Tarigan  PARHUSIP III ,kecamatan NAINGGOLAN, SAMOSIR |CVXH+795, Parhusip III, Kecamatan Nainggolan, Kabupaten Samosir, Sumatera Utara 22394|Nomor telepon tidak ditemukan|Alamat web tidak ditemukan|Kedai Tarigan|2.4481257|98.878487|Kedai Kopi|Tidak ada review|Tidak ada review
relusuri Google Maps PARHUSIP III ,kecamatan NAINGGOLAN, SAMOSIR |Gagal|Gagal|Gagal|Gagal|Gagal|Gagal|Gagal|Gagal|Gagal
Data peta2025 PARHUSIP III ,kecamatan NAINGGOLAN, SAMOSIR |Gagal|Gagal|Gagal|Gagal|Gagal|Gagal|Gagal|Gagal|Gagal
npol PARHUSIP III ,kecamatan NAINGGOLAN, SAMOSIR |Gagal|Gagal|Gagal|Gagal|Gagal|Gagal|Gagal|Gagal|Gagal
Indoneaia PARHUSIP III ,kecamatan NAINGGOLAN, SAMOSIR |Gagal|Gagal|Gagal|Gagal|Gagal|Gagal|Gagal|Gagal|Gagal
 Kirim Masukan Produk PARHUSIP III ,kecamatan NAINGGOLAN, SAMOSIR |Gagal|Gagal|Gagal|Gagal|Gagal|Gagal|Gagal|Gagal|Gagal
Lapisan PARHUSIP III ,kecamatan NAINGGOLAN, SAMOSIR |Gagal|Gagal|Gagal|Gagal|Gagal|Gagal|Gagal|Gagal|Gagal
